{"run_id":"2026-05-28-autonomous-slice","verdict":"Skill arm materially outperforms baseline overall. No catastrophic failures; both arms are schema-compliant. Main skill value is explicit decision framing, candidate-axis comparison, branch-logic semantics, pruning rationale, and richer leaf evidence plans. Main concern is occasional over-structured pruning output and uneven R1/R2 framing in some novel cases.","case_results":[{"case_id":"bps_sydney_airport_capacity","winner":"skill","baseline_total":34,"skill_total":40,"delta":6,"baseline_scores":{"problem_frame":4,"axis_selection":4,"mece_and_branch_logic":4,"expert_property_coverage":4,"hypothesis_and_decision_relevance":4,"asymmetric_depth_and_pruning":4,"leaf_resolution_actionability":5,"framework_misuse_penalty":5},"skill_scores":{"problem_frame":5,"axis_selection":5,"mece_and_branch_logic":5,"expert_property_coverage":5,"hypothesis_and_decision_relevance":5,"asymmetric_depth_and_pruning":5,"leaf_resolution_actionability":5,"framework_misuse_penalty":5},"schema_compliance":{"baseline":true,"skill":true},"catastrophic_failure":{"baseline":false,"skill":false},"notes":"Both find supply-demand bottleneck logic. Skill is stronger on R1/R2, minimum-bottleneck framing, controllable runway/slot levers, WSA relief, and explicit keep/defer/prune rationale."},{"case_id":"bps_solar_install_now","winner":"skill","baseline_total":34,"skill_total":40,"delta":6,"baseline_scores":{"problem_frame":4,"axis_selection":4,"mece_and_branch_logic":4,"expert_property_coverage":4,"hypothesis_and_decision_relevance":4,"asymmetric_depth_and_pruning":4,"leaf_resolution_actionability":5,"framework_misuse_penalty":5},"skill_scores":{"problem_frame":5,"axis_selection":5,"mece_and_branch_logic":5,"expert_property_coverage":5,"hypothesis_and_decision_relevance":5,"asymmetric_depth_and_pruning":5,"leaf_resolution_actionability":5,"framework_misuse_penalty":5},"schema_compliance":{"baseline":true,"skill":true},"catastrophic_failure":{"baseline":false,"skill":false},"notes":"Baseline handles install-now versus wait well but sidelines climate value. Skill keeps economics, waiting option, subsidies/tariffs, financing, execution risk, resilience, and emissions preference in one clearer decision structure."},{"case_id":"bps_salmon_conservation","winner":"skill","baseline_total":38,"skill_total":40,"delta":2,"baseline_scores":{"problem_frame":5,"axis_selection":5,"mece_and_branch_logic":4,"expert_property_coverage":5,"hypothesis_and_decision_relevance":5,"asymmetric_depth_and_pruning":4,"leaf_resolution_actionability":5,"framework_misuse_penalty":5},"skill_scores":{"problem_frame":5,"axis_selection":5,"mece_and_branch_logic":5,"expert_property_coverage":5,"hypothesis_and_decision_relevance":5,"asymmetric_depth_and_pruning":5,"leaf_resolution_actionability":5,"framework_misuse_penalty":5},"schema_compliance":{"baseline":true,"skill":true},"catastrophic_failure":{"baseline":false,"skill":false},"notes":"Baseline is strong and covers life-cycle bottlenecks, hatcheries, ocean uncertainty, and influenceability. Skill adds sharper abundance-diversity tension, governance/portfolio logic, and better cross-cutting policy treatment."},{"case_id":"minto_eval_003_sales_growth_gap","winner":"skill","baseline_total":34,"skill_total":40,"delta":6,"baseline_scores":{"problem_frame":4,"axis_selection":5,"mece_and_branch_logic":4,"expert_property_coverage":5,"hypothesis_and_decision_relevance":4,"asymmetric_depth_and_pruning":3,"leaf_resolution_actionability":4,"framework_misuse_penalty":5},"skill_scores":{"problem_frame":5,"axis_selection":5,"mece_and_branch_logic":5,"expert_property_coverage":5,"hypothesis_and_decision_relevance":5,"asymmetric_depth_and_pruning":5,"leaf_resolution_actionability":5,"framework_misuse_penalty":5},"schema_compliance":{"baseline":true,"skill":true},"catastrophic_failure":{"baseline":false,"skill":false},"notes":"Both use the three-stage process. Skill better separates signal validation, sales equation localization, process-stage diagnosis, and guardrail external/organization branches before fixes."},{"case_id":"minto_eval_006_energy_cost_driver_tree","winner":"skill","baseline_total":38,"skill_total":40,"delta":2,"baseline_scores":{"problem_frame":4,"axis_selection":5,"mece_and_branch_logic":5,"expert_property_coverage":5,"hypothesis_and_decision_relevance":5,"asymmetric_depth_and_pruning":4,"leaf_resolution_actionability":5,"framework_misuse_penalty":5},"skill_scores":{"problem_frame":5,"axis_selection":5,"mece_and_branch_logic":5,"expert_property_coverage":5,"hypothesis_and_decision_relevance":5,"asymmetric_depth_and_pruning":5,"leaf_resolution_actionability":5,"framework_misuse_penalty":5},"schema_compliance":{"baseline":true,"skill":true},"catastrophic_failure":{"baseline":false,"skill":false},"notes":"Baseline already uses the correct cost-driver split. Skill improves constraints, initiative nesting, conditional treatment of incentives/organization/product-to-mill, and quantified pruning logic."},{"case_id":"mind_acme_thrum_mat_cost","winner":"skill","baseline_total":34,"skill_total":39,"delta":5,"baseline_scores":{"problem_frame":4,"axis_selection":4,"mece_and_branch_logic":4,"expert_property_coverage":4,"hypothesis_and_decision_relevance":4,"asymmetric_depth_and_pruning":4,"leaf_resolution_actionability":5,"framework_misuse_penalty":5},"skill_scores":{"problem_frame":5,"axis_selection":5,"mece_and_branch_logic":5,"expert_property_coverage":4,"hypothesis_and_decision_relevance":5,"asymmetric_depth_and_pruning":5,"leaf_resolution_actionability":5,"framework_misuse_penalty":5},"schema_compliance":{"baseline":true,"skill":true},"catastrophic_failure":{"baseline":false,"skill":false},"notes":"Skill is stronger on must-be-true logic, quality gate, capacity monetization, and scale-up controls. Slight expert-coverage deduction because it does not clearly screen broader cost-reduction hypotheses before the curing-process hypothesis."},{"case_id":"mind_hsdd_market_sizing","winner":"skill","baseline_total":38,"skill_total":39,"delta":1,"baseline_scores":{"problem_frame":4,"axis_selection":5,"mece_and_branch_logic":5,"expert_property_coverage":5,"hypothesis_and_decision_relevance":5,"asymmetric_depth_and_pruning":4,"leaf_resolution_actionability":5,"framework_misuse_penalty":5},"skill_scores":{"problem_frame":5,"axis_selection":5,"mece_and_branch_logic":5,"expert_property_coverage":5,"hypothesis_and_decision_relevance":5,"asymmetric_depth_and_pruning":4,"leaf_resolution_actionability":5,"framework_misuse_penalty":5},"schema_compliance":{"baseline":true,"skill":true},"catastrophic_failure":{"baseline":false,"skill":false},"notes":"Both avoid naive TAM/SAM/SOM and center the diagnosis bottleneck. Skill adds richer triangulation and market-building levers, but its pruned tree is too expansive to be fully pruned."},{"case_id":"novel_public_company_diligence_001","winner":"skill","baseline_total":35,"skill_total":40,"delta":5,"baseline_scores":{"problem_frame":4,"axis_selection":4,"mece_and_branch_logic":4,"expert_property_coverage":4,"hypothesis_and_decision_relevance":5,"asymmetric_depth_and_pruning":4,"leaf_resolution_actionability":5,"framework_misuse_penalty":5},"skill_scores":{"problem_frame":5,"axis_selection":5,"mece_and_branch_logic":5,"expert_property_coverage":5,"hypothesis_and_decision_relevance":5,"asymmetric_depth_and_pruning":5,"leaf_resolution_actionability":5,"framework_misuse_penalty":5},"schema_compliance":{"baseline":true,"skill":true},"catastrophic_failure":{"baseline":false,"skill":false},"notes":"Skill better governs PE diligence through must-be-true investment tests: electrification quality, margin sustainability, FCF, liabilities, valuation, and public-company transaction path."},{"case_id":"novel_technical_architecture_001","winner":"skill","baseline_total":35,"skill_total":40,"delta":5,"baseline_scores":{"problem_frame":4,"axis_selection":4,"mece_and_branch_logic":4,"expert_property_coverage":5,"hypothesis_and_decision_relevance":5,"asymmetric_depth_and_pruning":4,"leaf_resolution_actionability":4,"framework_misuse_penalty":5},"skill_scores":{"problem_frame":5,"axis_selection":5,"mece_and_branch_logic":5,"expert_property_coverage":5,"hypothesis_and_decision_relevance":5,"asymmetric_depth_and_pruning":5,"leaf_resolution_actionability":5,"framework_misuse_penalty":5},"schema_compliance":{"baseline":true,"skill":true},"catastrophic_failure":{"baseline":false,"skill":false},"notes":"Both avoid microservices cargo culting. Skill is stronger on binding-bottleneck diagnosis, minimum sufficient architecture path, procurement hard gates, migration-risk gate, and stop conditions."},{"case_id":"novel_policy_001","winner":"tie","baseline_total":37,"skill_total":37,"delta":0,"baseline_scores":{"problem_frame":5,"axis_selection":4,"mece_and_branch_logic":4,"expert_property_coverage":5,"hypothesis_and_decision_relevance":5,"asymmetric_depth_and_pruning":4,"leaf_resolution_actionability":5,"framework_misuse_penalty":5},"skill_scores":{"problem_frame":4,"axis_selection":4,"mece_and_branch_logic":5,"expert_property_coverage":5,"hypothesis_and_decision_relevance":5,"asymmetric_depth_and_pruning":4,"leaf_resolution_actionability":5,"framework_misuse_penalty":5},"schema_compliance":{"baseline":true,"skill":true},"catastrophic_failure":{"baseline":false,"skill":false},"notes":"Both cover emissions, affordability, grid, fiscal, implementation, and politics. Baseline has slightly better explicit governor decision frame; skill has cleaner MECE mechanics but generic pruning."},{"case_id":"novel_scientific_evidence_001","winner":"tie","baseline_total":38,"skill_total":38,"delta":0,"baseline_scores":{"problem_frame":5,"axis_selection":4,"mece_and_branch_logic":5,"expert_property_coverage":5,"hypothesis_and_decision_relevance":5,"asymmetric_depth_and_pruning":4,"leaf_resolution_actionability":5,"framework_misuse_penalty":5},"skill_scores":{"problem_frame":5,"axis_selection":4,"mece_and_branch_